{
  "sender_id": "5709255c-c0ae-4e1e-99a0-e872e83e48e0",
  "master_enable": true,
  "activation": {
    "mode": "activate_immediate",
    "requested_time": null
  },
  "transport_params": [{
    "interface_ip": "192.168.200.15",
    "multicast_ip": null,
    "source_ip": "192.168.200.10",
    "destination_port": 5000,
    "rtp_enabled": true
  }]
}
